id,url,title,company_name,company_logo,category,tags,job_type,publication_date,candidate_required_location,salary,description,application_status
2071614,https://remotive.com/remote-jobs/data/head-of-data-2071614,Head of Data,Kit,https://remotive.com/job/2071614/logo,Data Analysis,"python, sql, data warehousing",full_time,2025-11-01 18:51:49,USA,"$207,000 - $234,000","Kit is an email-first operating system for creators who mean business. We help creators grow and monetize their audience with ease. For coaches, YouTubers, authors, podcasters, and other creatives, there isn't a better marketing hub to rely on to grow audiences, automate email marketing, and sell digital products — all within one platform. More importantly, there isn't a team more committed to helping creators earn a living. We're on a mission to help creators earn $1 billion using our creator marketing platform. We have always been 100% independent and 100% remote.We are proud to have built a product that our customers love, and we look for people who have enthusiasm and belief in our mission, vision, and values to join our team. We're also embracing AI thoughtfully — both in how we build and how we hire to ensure our team is adaptable, innovative, and ready for what's next.The roleAs data becomes increasingly central to how we scale, we need a senior data leader to transform our data capabilities into a strategic advantage. We're looking for a Head of Data to build and lead a centralized data team that will define how we collect, analyze, and leverage data across Kit to accelerate creator success.This is a player-coach role for someone who thrives at the intersection of technical excellence and strategic leadership, enjoys building and scaling teams, and is energized by the opportunity to shape data culture at a scaling company.This role is for someone who has successfully built data functions in high-growth environments and is ready to own the complete data roadmap for a mission-driven company.Your support systemYou'll report to the Chief Operating Officer (COO) and serve as a primary data thought partner to the executive leadership team. You'll collaborate closely with Product, Engineering, Growth, Finance, and Business Operations teams. Your direct team will initially include Data Engineers and Analysts.What you'll doFirst Week: Dive into our data infrastructure, tooling (Snowflake, dbt, Dagster, Tableau), and current reporting workflows. Take part in Get To Know You's (GTKYs) to meet our distributed team and understand data needs across functions.First Month: Conduct a comprehensive assessment of our data maturity, gaps, and opportunities. Meet with stakeholders across product, growth, and operations to understand their data pain points. Begin defining short-term quick wins and your long-term data roadmap.First Six Months: Establish foundational data practices including governance standards, documentation protocols, and collaboration frameworks. Deliver meaningful improvements to our core KPI reporting and analytics infrastructure. Present your comprehensive data strategy and roadmap to the executive team.First Year: You'll lead a high-performing data team with clear roles and career paths. Your team will have transformed how Kit leverages data—from improved decision-making velocity across the company to new product capabilities powered by predictive analytics. You'll play a key role in helping Kit achieve its mission of earning creators $1 billion by ensuring every strategic decision is grounded in trustworthy, accessible data.What will S.E.T. you up for successSkillsDeep technical expertise across the modern data stack (data warehousing, ELT/ETL, BI tools)Advanced SQL mastery and proficiency in Python or R for data science applicationsStrategic thinking and roadmap development for data initiativesExecutive communication and data storytellingTeam building, mentorship, and performance managementCross-functional stakeholder management and influence without authorityExperiences10+ years of progressive experience in data-related fields (data engineering, analytics, data science)5+ years in people management roles, leading and developing data professionalsProven success building and scaling a data function from early stage to maturity, preferably in a startup or high-growth technology environmentHands-on experience with modern data platforms (Snowflake, BigQuery, or Redshift), transformation tools (dbt), orchestration (Airflow or Dagster), and BI tools (Omni, Tableau, Looker, Metabase, or Power BI). We're in the process of implementing Omni.Track record of implementing data governance, quality frameworks, and security protocolsExperience applying machine learning, predictive modeling, or NLP to solve business problems (bonus: in creator economy, SaaS, or product-led growth environments)TraitsServant leadership mindset with a genuine commitment to developing othersStrategic thinker who can balance long-term architectural vision with pragmatic, near-term executionExceptional communicator who can translate complex technical concepts for diverse audiencesIntellectually curious with a bias toward action and experimentationComfortable with ambiguity and able to create structure where none existsLow ego, high ownership—measures success by team health and business impact, not personal creditWhat won't set you up for successSeeking a purely managerial role without hands-on technical contributionPreferring to maintain existing systems over building and innovatingUncomfortable with rapid change or shifting priorities in a high-growth environmentUnable to communicate complex technical work in simple, business-focused languageViewing data as a support function rather than a strategic business driverWorking hours and location:We're 100% remote with team members across the globe. We work mostly on East Coast time—so if you're based on the West Coast of the United States, Europe, or Asia, you might have a few early mornings or late evenings. We do our best to keep things reasonable, but a little time zone juggling comes with the territory. Given the cross-functional nature of this role, overlap with US business hours (EST) is important for collaboration with executive and product teams.Compensation + perks + benefits:Kit has standardized salaries based on position, no matter where you live. For this role, we’re hiring at our level M4 ($207,000) or M5 ($234,000). Level is determined based on experience and our interview process.Perks + benefits include:Profit SharingKit equity401k with a 5% matchWe cover up to $1,950 per month toward medical premiums, with dental and vision premiums fully covered. We offer Health Insurance plans through Aetna.$4,000 equipment allowance for your first two years, $3,000 budget every following two yearsIndividual learning + development budget ($3,500/year)Gender affirming benefitsChildcare benefit up to $3,000 annuallyTwenty (20) days of paid time off during each year of employmentPaid paid vacation: An after-tax bonus of $1,000 for taking five consecutive days of vacation where you’re fully unplugged from workTen (10) paid holidays a yearTwo weeks of paid sick time each year, including mental health + well being daysTwelve (12) weeks paid parental leave and flexible scheduling in your child’s first yearUp to six weeks of paid bereavement leave, medical leave, and disaster after six months of employment, two weeks of each paid leave in your first six monthsWinter Break Closure: Kit closes for a week at the end of December, giving everyone a collective break to enjoy the holiday season. Essential support services remain available, with teams coordinating to ensure coverage during this periodFour-week, paid sabbatical after five years with the teamFantastic in-person or virtual retreats with the team twice a yearHow to applyWe know that most people hate interviewing (we relate!). We aim to make it as good of an experience as we can, and part of that includes keeping you informed during the process.Here's what you can expect from the process:A phone screen with our recruiterHiring manager interview with the COOTake-home assignmentPanel interviewFinal interview with the COOWe’ll keep you informed through every step. To get started, complete this application, including a cover letter and answers to the questions on the next page. We read every single application, and your cover letter and responses help put your experience into context.Kit is an equal opportunity employerWe value diversity in all of its forms. Research tells us that applicants who are female or non-binary, as well as applicants who are people of color, are less likely to apply for roles they do not feel 100% qualified for. If you think you meet more than 50% of our requirements but fewer than 100% of them, please apply. We’re imperfect communicators, so think of our job postings as the starting point for discussion rather than proof that you shouldn’t apply.Kit does not discriminate on the basis of race, sex, color, religion, age, national origin, marital status, disability, veteran status, genetic information, sexual orientation, gender identity or any other reason prohibited by law in provision of employment opportunities and benefits.",False
2071589,https://remotive.com/remote-jobs/project-management/business-project-coordinator-2071589,Business Project Coordinator,Johns Hopkins University,https://remotive.com/job/2071589/logo,Project Management,research,full_time,2025-11-01 18:51:37,USA,"usd 53,800 - 94,400 per year","The Department of Radiology is seeking a Business Project Coordinator that will support the management team by providing administrative and project support to ensure the smooth and efficient operations of the department.  The ideal candidate will provide ideas and solutions to all projects as well as maintain some of the duties of a collection specialist. A successful candidate will be pivotal in assisting the department in accomplishing the goals, and initiatives in the department.Specific Duties and ResponsibilitiesManage and complete extensive research to ensure positive outcome on all project work.	Work with managers and faculty to identify needs, coordinate processes and oversee projects to completions.  Prepare special reports needed to report to leadership needs and concerns.Maintain confidentially since dealing regularly with privileged information.Anticipate and problem-solve issue and concerns that will impact the department.Responsible for answering questions, providing guidance, and disseminating information regarding A/R concerns as necessary.Exercises independent judgement in the resolution of issues problems.Work throughout Radiology divisions to assist with other project needs when necessary.Continue the tasks and responsibilities of a collection specialist.Assist in training staff.Participate in meetings and conference calls.Audit team members to maintain quality of work.Assist with charge corrections and other minor coding issues.Stay abreast of insurance guidelines (attending webinars and providing updates from websites)Minimum QualificationsBachelor's DegreeThree years related experience with some project management experience.Additional education may substitute for required experience, and additional related experience may substitute for required education beyond a high school diploma/graduation equivalent, to the extent permitted by the JHU equivalency formula. 

 
Classified Title: Business Project Coordinator   Role/Level/Range: ATP/03/PC  Starting Salary Range: $53,800 - $94,400 Annually ($55,000 targeted; Commensurate w/exp.) Employee group: Full Time Schedule: m-F 8:30-5:00 FLSA Status: Exempt Location: Remote Department name: SOM Rad Production Unit Billing   Personnel area: School of Medicine 
 
 

",False
2071520,https://remotive.com/remote-jobs/software-dev/go-backend-developer-2071520,Go Backend Developer,Nextlink Labs,https://remotive.com/job/2071520/logo,Software Development,"git, golang, postgresql",contract,2025-11-01 18:50:59,"Northern America, South America",competitive pay in usd,"About NextLink LabsNextLink Labs is a fast growing technology firm focused on helping companies build, scale, and secure their software applications and organizations. We believe that in order for companies, teams, and products to succeed, technology must be utilized effectively and securely. We pride ourselves in helping our clients win in their respective industries.As a remote-first company with team members spread out all across the country, NextLink Labs continuously works to ensure our work environment is comfortable and collaborative. We also aim to maintain an inclusive work environment where everyone can thrive professionally and live full lives outside of work.Position SummaryNextLink Labs is seeking a motivated Backend Developer with a strong background in Golang to join our Custom Software Development consulting team. A successful person in this role will be tasked with building and maintaining scalable backend services and APIs for our clients and will be able to seamlessly integrate with our clients engineering teams.Key ResponsibilitiesAs a Backend Developer, you will design and implement robust backend systems and RESTful APIs while making critical architecture decisions to rapidly deliver features for a recently-launched application entering its ""Go to Market"" phase. If you are a self-motivated engineer looking to take ownership of your work, we invite you to join our team at NextLink Labs.What You'll DoDesign, develop, and maintain scalable backend services and APIs using GolangWork with other engineers to architect and implement microservices-based solutionsCommunicate directly with clients to give demonstrations and receive feedbackOptimize database queries and application performance for high-traffic systemsWork in an agile team environment with daily stand ups, and weekly agile meetingsEngage in code reviews of your teammates' workRequired Qualifications3+ years of experience building backend services with GolangStrong understanding of Golang concurrency patterns, goroutines, and channelsExperience designing and implementing RESTful APIs and/or GraphQL servicesProficiency with relational databases (PostgreSQL)Ability to work independently and take ownership in a variety of software engagementsAbility to scope individual features and full software projects based on client requestsExcellent written, verbal, and interpersonal skills with the ability to build buy-in, facilitate compromise, and guide client expectationsStrong unit-testing and debugging abilitiesProficient understanding of version control systems (Git)Understanding of security best practices and compliance requirementsUnderstanding of fundamental design principles behind scalable and distributed systemsStrong problem-solving, analytical, and strategic thinking abilities, capable of making well-informed and timely decisionsNice to HaveExperience integrating software platforms with e-commerce APIs (Shopify)Experience with microservices architecture and message queues (Kafka)Experienced with DevOps tooling (AWS, Terraform, Docker, Kubernetes)Why NextLink LabsThis is a contractor role, open to candidates located in North or South America, offering competitive pay (in USD) and 100% remote work. Coverage for exams and certifications is provided to support your professional growth. You’ll be equipped with a state-of-the-art laptop and tools, and join an exceptional global team that fosters collaboration, learning, and continuous growth.",False
